{
  "name": "SkillForge Avalanche Credential #2",
  "description": "Issuer-attested SkillForge credential on Avalanche.",
  "image": "ipfs://bafybeigdyrzt5sfp7udm7hu76uh7y26nf3efuylqabf3oclgtqy55fbzdi",
  "attributes": [
    { "trait_type": "Total Points", "value": 80 },
    { "trait_type": "Puzzle Pieces", "value": 16 },
    { "trait_type": "Easy Correct", "value": 5 },
    { "trait_type": "Medium Correct", "value": 5 },
    { "trait_type": "Hard Correct", "value": 5 },
    { "trait_type": "Attestation", "value": "Issuer attested" }
  ]
}
