{
  "name": "SkillForge Avalanche Credential #1",
  "description": "Self-claimed SkillForge score record on Avalanche.",
  "image": "ipfs://bafybeigdyrzt5sfp7udm7hu76uh7y26nf3efuylqabf3oclgtqy55fbzdi",
  "attributes": [
    { "trait_type": "Total Points", "value": 15 },
    { "trait_type": "Puzzle Pieces", "value": 1 },
    { "trait_type": "Easy Correct", "value": 5 },
    { "trait_type": "Medium Correct", "value": 0 },
    { "trait_type": "Hard Correct", "value": 0 },
    { "trait_type": "Attestation", "value": "Self claimed" }
  ]
}
